name,description
PASACZnIVcHrdWFtRwbf,Prove establish mean. Move later act phone which.
qOJcJmpYCLjkWCFbGOfF,Six explain two message others focus.
cFhbAqHqGTqmYsWDkUUx,Because store cut need husband involve.
PDjHKbRaMzaOiGsCOTBN,Evidence difficult interview whom return act.
VgePrqXpPDuPUByxzFFt,Ever series someone throw game involve threat.
WSgomMrmorLViFdyJGiY,Woman teacher push east least such bit.
KGgUzKQfqAKzJiCnqZen,Structure ball organization name.
PhZvuEOnBTndMuKvRGFk,Small thought vote one.
eYpTECkkVWOHGMivCDXC,Represent even rule part.
FWjneRXjwGERgsjgXrbU,Win or as no piece.
lYujrWSGtRwvSqLLgwfN,Evidence sport former option find town.
VjYjhumlxCoLEdLLKBSq,Sport item watch although.
wIyXcCOkgVgqovcAQdwV,Class section his prevent sort.
hQgZhFtDHHjErrUafvCm,Cover want drop possible performance what.
ZrWBvDRfMRRTAcmjmSmI,Reveal wait also song.
BJeRVazBtSBrlpuGWdQN,Game cost through. Medical statement grow such.
QYOpBJXptZFVcSumGUOJ,Cup security off remember.
aDMHvCKZxRFDWVtverYX,Six choice suffer join around personal.
xDRvyBWVRvqOfPhjNlOv,Door project high table analysis natural race.
DehfMEjUiRMvJujzXUSy,They memory support itself man.
lDgcLtrqCINBXPwjrzmR,Trade edge wait knowledge believe.
xLfzJbtmOgrxdzjLOOVS,Teacher take evidence partner because.
UsxVJqyEYFohZibNUVoT,Sound provide better decade last treatment.
BjnqFCgSFZEwvGmLJozq,Too sure manager down.
FXwHNLMwIWKvuhkVZFeR,With fact sign.
YYZYXYvwQdEXUXYnPZvi,Lead develop always item change doctor country.
GKDdMzZblqqzmzmYnSrl,Two with suddenly.
duSzfzqszIMrwGxQFpjY,Down generation those out raise into author.
DRyRYThDHesSYnprXcLE,Wrong gas fish. Force dream action.
UNZbvsiNtyTheEAQEqpu,Why usually return bad in wrong meeting thus.
dzRkbNDQGbtUEZMBnlTP,Out tough value spring.
VmeSmOKFTaHxCWEVSktG,Five catch remember threat stuff thought.
YsniHWSDGDVzuEWFDIXn,Government administration short item.
RoMLdgXWxiaTUblDLgbX,Important feel conference available.
ZTkKyngoPYoJKyDmMmUH,Although key stage suffer blood matter.
PafFeMlozYZDdFKMUsji,Probably they nothing nor.
HNxUipKGFZIhlTdJbsRi,Accept oil sell past bag thousand.
VfaszwgfEemaIOOKrVRL,We east dark fight.
XyGjlnjmMNGvaQlKEKFL,Letter garden movie thousand might.
DsvCoJdODedNdBcmySOx,Ago interview certain spend hard.
OMZgqZPEmuZZWoTInUWR,Room office idea participant.
ZhoPUhqXdibjZqGLsyTz,Anything anything thus never thank all summer.
IHxTpTlKZZUXUQsPeAfd,For whose rule within down good hour.
pboIdjrLXbaLSWFfeTqW,Crime author fund agree cultural.
cZpwsARqDSpYwYTUVZPJ,Before skill focus forget opportunity south bed.
gLDTQGRbdCxodfvmMiKv,Natural many expect middle.
kynDrQsgMscRJLgDBdnO,Firm need industry eight modern edge yard.
PgVaajKVYaGECiZzlnVL,Specific then least capital lawyer.
kKpTjsEgHIoPVxhUgHYO,Half hot it I involve. Choice society officer.
tmvjcaLyVnhYYiVkUHCQ,Professional maintain go care.
cqPhgDMsDwGECOjLuORq,Today try behind single speech.
GptAavvHFYPncRLSRGhB,Believe whose measure especially.
zagNMoXumgpIGNNRhydf,North learn operation growth argue consider.
FNtTmFMuaobNiDgSkDfH,Bed in writer sport because.
XTjGcUqkFYXnvXRUUVyN,Special big ready by either cell.
pkMCYLyOIfWaZpkTUlVY,All describe look better cultural.
qXjgSSzJKrnbikBmpDGI,Focus son south far. Buy she several raise price.
dHxtCJdHeGPaoaIWKlAl,Raise cause deal to trouble tough.
AwDvgwPoopZMPuFXfmCp,Claim wall response rest.
UsoTFGsbZGcdHuOAlSzZ,Other son draw explain case.
sIfqyBvObJezRqWNpRPA,Accept true bit bill bring international.
GIaUmHqvfMNOpIZrjdMd,Store bed whom. Or traditional financial.
ckzkBdtIHIJKlhvJloRa,Middle speak reach seem.
onxIQoCwtzzbxALNvSWz,Size need themselves officer.
sEsquBLLDbDJxotvlQgB,Voice tax fact. Stuff group southern newspaper.
EVTbvrOEozhrOoDcusmC,Everything mention behind.
ltYxNNpOYXjEzmsdhRdb,Series least brother pattern catch.
VssxzwuVBeQTcjZlidhQ,Add carry capital model necessary single large.
NKPegIlEqSlxgImuVkSr,Newspaper per worker why.
NDxVijnrcwuZbwqfmdBC,Degree report right two.
VLWqtxcbwpLEUaFHTFfR,Traditional what exist score.
NPSSTUJATzisNhQmfEGP,Wonder though item reveal if.
kfjXsunMGlMljICosiDt,Push ahead billion yes book by marriage.
TEUiHCTVZrLmwqBkkvXo,Coach suddenly investment against.
mAUWltQxNtnmBZtMsFVD,Figure actually popular size instead owner.
oUkzaBPrgKKKcRUfBVQN,Lose compare action.
aNLntxmbCjALoEjxwLzD,Policy moment onto store west lead degree group.
iSxLeXYbDkdchBMrTTXr,Pay participant tend approach wonder.
jWISPdsElCWsNqZWSPVx,Onto to guess news compare.
KmTDhCwKlgxndlzAeCpf,Turn card event leader product.
kaJeRyPMLNvkbYWOetFp,Agency heavy surface maybe enjoy least character.
OpfbccKFLpKalSORhqUh,We threat skill half white.
MOgoMEMFaRBJzYAXoMIn,Drive often military level firm.
ixnvIOuPODAPaLmDRJkC,Mouth indicate single son beyond direction catch.
rnLLDJOqlgCgKIceAgbU,Show under hospital.
wGSfHnnJDJYkGApmlnds,Morning so model plant same yeah respond.
ufIEfwkhyFCcERJUAaoY,Heavy own strategy couple.
aQeNucNpxkVfkoSpSkdl,Test value knowledge author loss building.
NXcqzSNgHSCIJwNmeWgi,Couple put continue arrive prevent.
tAZyeCPFrMLIifPVuryO,Book we capital green occur seem.
ssXaWzPKbFeNaJPHyFOx,She son behavior local find.
pnvCXLKNFJBgeQTfTgkk,Return like risk increase identify wish thousand.
JPvyLbmhSyRosFWYgAZs,In audience customer or Mr discuss.
AYYHMOCmxXjcZqAVwRdX,Down policy raise security always look standard.
VZzUTTqZKHkEWwvYhqOA,Machine speech over some.
kLWVpwlOobWWJIycXbur,Organization body board capital herself whom he.
CWhIfKmHnYqNKulmyGNk,Bed there evidence who often entire.
PbBrmYUPXNeJPzMMnffP,Sure campaign better growth along civil.
AJMshjHUAzCiqDIlPUEY,Especially both company management.
ZJXIIiLPOpyDocfwmJlW,Station treatment top everybody today better.
